name,email,company,title,website,phone,source,notes
Suresh Patil,suresh@packright.example.com,PackRight Industries,Owner,https://packright.example.com,,icp-ovm-mfg,"Mumbai packaging; PDF catalogue + WhatsApp quotes. Trigger: lost export RFQs. Fit: Lead Platform ₹1.25L–₹2L. City: Mumbai."
Mehul Shah,mehul@gujflexo.example.com,Gujarat Flexo Pack,Sales Director,https://gujflexo.example.com,,icp-ovm-mfg,"Ahmedabad flexibles; template site; no SEO product pages. City: Ahmedabad."
Anita Deshmukh,anita@puneprecision.example.com,Pune Precision Components,Partner,https://puneprecision.example.com,,icp-ovm-mfg,"CNC / auto ancillaries; enquiry form dead. City: Pune."
Vikram Reddy,vikram@deccanpoly.example.com,Deccan Polymers,Owner,https://deccanpoly.example.com,,icp-ovm-mfg,"Hyderabad plastics exporter; competitor ranking on Google. City: Hyderabad."
Kavita Jain,kavita@northbelt.example.com,Northbelt Fasteners,Marketing Manager,https://northbelt.example.com,,icp-ovm-mfg,"Delhi-NCR fasteners; owner-access buyer. Trigger: new product line. City: Delhi NCR."
